{
  "id": "sil_dual_state_0.01",
  "kind": "silhouette",
  "version": 1,
  "rule_version": "scandoc-silhouette-invariants/v1",
  "created_at": null,
  "outline": {
    "motif": "dual_state",
    "scale": 0.01
  },
  "completeness": "intentionally_incomplete",
  "semantic_payload": null,
  "sentinel": "5e9076ccf632966caf28947cebea7fed45c7cbc91bbb742e4def6f6adcb645e37f602c998bf9838aeeab68818fb4f99d1f1d616093653365187802b749674035"
}
