{
  "id": "sil_chaos_line_0.01",
  "kind": "silhouette",
  "version": 1,
  "rule_version": "scandoc-silhouette-invariants/v1",
  "created_at": null,
  "outline": {
    "motif": "chaos_line",
    "scale": 0.01
  },
  "completeness": "intentionally_incomplete",
  "semantic_payload": null,
  "sentinel": "5f42561214750861f9be44bcfbcb8d0f2b55b1b7147529351e10855a9f80633ab064ef92116cdac808bbe330417e1a55591cae5727f9ec648f49c54b43b6914d"
}
